<?xml version="1.0"?>
<!DOCTYPE employee SYSTEM "LearningBasic.dtd" [
        <!ENTITY yest "&#97;">
        ]>
<employee>
    <name id="babu" s="5">Abdul kader</name>
    <age id="200">31</age>
    <address>
        <house>38</house>
        <road>11</road>
        <city>Dhaka</city>
        <country>
            <state>BD</state>
            Bangladesh
        </country>
        &yest;
    </address>

</employee>